{
  "schema_version": "1.0",
  "id": "retest-auto-09580c97-1",
  "benchmark_id": "stop-sign-perceptual",
  "benchmark_hash": "sha256:6688d2250abd980b6564a429d84dc69429bdf51f88677561797ecc16452bfb37",
  "model": {
    "provider": "openrouter",
    "model_id": "google/gemini-2.5-flash",
    "params": {
      "temperature": 0.0,
      "max_tokens": 2048,
      "stop": []
    }
  },
  "endorsement_config": {
    "n_samples": 3,
    "tie_break": "abstain",
    "verification_prompt_id": "defeasible-explicit-v1",
    "context_builder_premise_id": "conjunction-and-v1",
    "context_builder_conclusion_id": "disjunction-or-v1"
  },
  "framework_version": "0.15.2",
  "started_at": "2026-06-08T05:55:52.076810Z",
  "finished_at": "2026-06-08T05:55:58.060974Z",
  "items": [
    {
      "id": "row-0",
      "premises": [
        "sa"
      ],
      "conclusions": [
        "ra"
      ],
      "analyst_verdicts": [
        "good"
      ],
      "model_verdict": "good",
      "samples": [
        {
          "sample_index": 0,
          "raw_response": "GOOD",
          "parsed_verdict": "good",
          "parse_status": "ok",
          "request_id": "retest-auto-09580c97-1:row-0:sample-0",
          "wall_time_ms": 396.6138340183534,
          "usage": {
            "input_tokens": 223,
            "output_tokens": 1
          },
          "finish_reason": "stop",
          "reasoning_tokens": 0
        },
        {
          "sample_index": 1,
          "raw_response": "GOOD",
          "parsed_verdict": "good",
          "parse_status": "ok",
          "request_id": "retest-auto-09580c97-1:row-0:sample-1",
          "wall_time_ms": 522.8315000131261,
          "usage": {
            "input_tokens": 223,
            "output_tokens": 1
          },
          "finish_reason": "stop",
          "reasoning_tokens": 0
        },
        {
          "sample_index": 2,
          "raw_response": "GOOD",
          "parsed_verdict": "good",
          "parse_status": "ok",
          "request_id": "retest-auto-09580c97-1:row-0:sample-2",
          "wall_time_ms": 336.00137499161065,
          "usage": {
            "input_tokens": 223,
            "output_tokens": 1
          },
          "finish_reason": "stop",
          "reasoning_tokens": 0
        }
      ],
      "majority_vote": {
        "good": 3,
        "bad": 0,
        "abstain": 0,
        "verdict": "good",
        "tie_broken": false
      },
      "tags": [
        "base-inference"
      ],
      "references": []
    },
    {
      "id": "row-1",
      "premises": [
        "n",
        "sa"
      ],
      "conclusions": [
        "ra"
      ],
      "analyst_verdicts": [
        "good"
      ],
      "model_verdict": "good",
      "samples": [
        {
          "sample_index": 0,
          "raw_response": "GOOD",
          "parsed_verdict": "good",
          "parse_status": "ok",
          "request_id": "retest-auto-09580c97-1:row-1:sample-0",
          "wall_time_ms": 524.3097080092411,
          "usage": {
            "input_tokens": 227,
            "output_tokens": 1
          },
          "finish_reason": "stop",
          "reasoning_tokens": 0
        },
        {
          "sample_index": 1,
          "raw_response": "GOOD",
          "parsed_verdict": "good",
          "parse_status": "ok",
          "request_id": "retest-auto-09580c97-1:row-1:sample-1",
          "wall_time_ms": 360.5801670055371,
          "usage": {
            "input_tokens": 227,
            "output_tokens": 1
          },
          "finish_reason": "stop",
          "reasoning_tokens": 0
        },
        {
          "sample_index": 2,
          "raw_response": "GOOD",
          "parsed_verdict": "good",
          "parse_status": "ok",
          "request_id": "retest-auto-09580c97-1:row-1:sample-2",
          "wall_time_ms": 401.78429198567756,
          "usage": {
            "input_tokens": 227,
            "output_tokens": 1
          },
          "finish_reason": "stop",
          "reasoning_tokens": 0
        }
      ],
      "majority_vote": {
        "good": 3,
        "bad": 0,
        "abstain": 0,
        "verdict": "good",
        "tie_broken": false
      },
      "tags": [
        "irrelevant-addition",
        "nighttime"
      ],
      "references": []
    },
    {
      "id": "row-2",
      "premises": [
        "n",
        "nr",
        "sa"
      ],
      "conclusions": [
        "ra"
      ],
      "analyst_verdicts": [
        "good"
      ],
      "model_verdict": "bad",
      "samples": [
        {
          "sample_index": 0,
          "raw_response": "BAD",
          "parsed_verdict": "bad",
          "parse_status": "ok",
          "request_id": "retest-auto-09580c97-1:row-2:sample-0",
          "wall_time_ms": 456.9787500076927,
          "usage": {
            "input_tokens": 235,
            "output_tokens": 1
          },
          "finish_reason": "stop",
          "reasoning_tokens": 0
        },
        {
          "sample_index": 1,
          "raw_response": "BAD",
          "parsed_verdict": "bad",
          "parse_status": "ok",
          "request_id": "retest-auto-09580c97-1:row-2:sample-1",
          "wall_time_ms": 363.21633399347775,
          "usage": {
            "input_tokens": 235,
            "output_tokens": 1
          },
          "finish_reason": "stop",
          "reasoning_tokens": 0
        },
        {
          "sample_index": 2,
          "raw_response": "BAD",
          "parsed_verdict": "bad",
          "parse_status": "ok",
          "request_id": "retest-auto-09580c97-1:row-2:sample-2",
          "wall_time_ms": 957.8217079979368,
          "usage": {
            "input_tokens": 235,
            "output_tokens": 1
          },
          "finish_reason": "stop",
          "reasoning_tokens": 0
        }
      ],
      "majority_vote": {
        "good": 0,
        "bad": 3,
        "abstain": 0,
        "verdict": "bad",
        "tie_broken": false
      },
      "tags": [
        "irrelevant-addition",
        "nonreflective"
      ],
      "references": []
    },
    {
      "id": "row-3",
      "premises": [
        "ba",
        "sa"
      ],
      "conclusions": [
        "ra"
      ],
      "analyst_verdicts": [
        "bad"
      ],
      "model_verdict": "bad",
      "samples": [
        {
          "sample_index": 0,
          "raw_response": "BAD",
          "parsed_verdict": "bad",
          "parse_status": "ok",
          "request_id": "retest-auto-09580c97-1:row-3:sample-0",
          "wall_time_ms": 774.0421670023352,
          "usage": {
            "input_tokens": 229,
            "output_tokens": 1
          },
          "finish_reason": "stop",
          "reasoning_tokens": 0
        },
        {
          "sample_index": 1,
          "raw_response": "BAD",
          "parsed_verdict": "bad",
          "parse_status": "ok",
          "request_id": "retest-auto-09580c97-1:row-3:sample-1",
          "wall_time_ms": 518.8504999969155,
          "usage": {
            "input_tokens": 229,
            "output_tokens": 1
          },
          "finish_reason": "stop",
          "reasoning_tokens": 0
        },
        {
          "sample_index": 2,
          "raw_response": "BAD",
          "parsed_verdict": "bad",
          "parse_status": "ok",
          "request_id": "retest-auto-09580c97-1:row-3:sample-2",
          "wall_time_ms": 345.7635829981882,
          "usage": {
            "input_tokens": 229,
            "output_tokens": 1
          },
          "finish_reason": "stop",
          "reasoning_tokens": 0
        }
      ],
      "majority_vote": {
        "good": 0,
        "bad": 3,
        "abstain": 0,
        "verdict": "bad",
        "tie_broken": false
      },
      "tags": [
        "defeater",
        "painted-blue"
      ],
      "references": []
    }
  ],
  "references": [],
  "paraphrase_variant": 0
}
