{
  "schema_version": "1.0",
  "id": "retest-auto-d6da4c5b-1",
  "benchmark_id": "stop-sign-perceptual",
  "benchmark_hash": "sha256:6688d2250abd980b6564a429d84dc69429bdf51f88677561797ecc16452bfb37",
  "model": {
    "provider": "openrouter",
    "model_id": "qwen/qwen3.6-flash",
    "params": {
      "temperature": 0.0,
      "max_tokens": 2048,
      "top_p": null,
      "seed": null,
      "stop": []
    }
  },
  "endorsement_config": {
    "n_samples": 3,
    "tie_break": "abstain",
    "verification_prompt_id": "defeasible-explicit-v1",
    "context_builder_premise_id": "conjunction-and-v1",
    "context_builder_conclusion_id": "disjunction-or-v1",
    "question_form": "support",
    "coherence_frame_id": "thin-v1"
  },
  "framework_version": "0.15.2",
  "started_at": "2026-06-08T05:57:17.403636Z",
  "finished_at": "2026-06-08T05:58:45.330060Z",
  "items": [
    {
      "id": "row-0",
      "premises": [
        "sa"
      ],
      "conclusions": [
        "ra"
      ],
      "analyst_verdicts": [
        "good"
      ],
      "analyst_rationales": null,
      "model_verdict": "good",
      "samples": [
        {
          "sample_index": 0,
          "raw_response": "GOOD",
          "parsed_verdict": "good",
          "parse_status": "ok",
          "request_id": "retest-auto-d6da4c5b-1:row-0:sample-0",
          "wall_time_ms": 5846.080209012143,
          "usage": {
            "input_tokens": 244,
            "output_tokens": 685
          },
          "finish_reason": "stop",
          "reasoning_tokens": 679,
          "provider_error": null
        },
        {
          "sample_index": 1,
          "raw_response": "GOOD",
          "parsed_verdict": "good",
          "parse_status": "ok",
          "request_id": "retest-auto-d6da4c5b-1:row-0:sample-1",
          "wall_time_ms": 4319.586792000337,
          "usage": {
            "input_tokens": 244,
            "output_tokens": 519
          },
          "finish_reason": "stop",
          "reasoning_tokens": 513,
          "provider_error": null
        },
        {
          "sample_index": 2,
          "raw_response": "GOOD",
          "parsed_verdict": "good",
          "parse_status": "ok",
          "request_id": "retest-auto-d6da4c5b-1:row-0:sample-2",
          "wall_time_ms": 4041.815749980742,
          "usage": {
            "input_tokens": 244,
            "output_tokens": 508
          },
          "finish_reason": "stop",
          "reasoning_tokens": 502,
          "provider_error": null
        }
      ],
      "majority_vote": {
        "good": 3,
        "bad": 0,
        "abstain": 0,
        "verdict": "good",
        "tie_broken": false
      },
      "tags": [
        "base-inference"
      ],
      "references": []
    },
    {
      "id": "row-1",
      "premises": [
        "n",
        "sa"
      ],
      "conclusions": [
        "ra"
      ],
      "analyst_verdicts": [
        "good"
      ],
      "analyst_rationales": null,
      "model_verdict": "bad",
      "samples": [
        {
          "sample_index": 0,
          "raw_response": "BAD",
          "parsed_verdict": "bad",
          "parse_status": "ok",
          "request_id": "retest-auto-d6da4c5b-1:row-1:sample-0",
          "wall_time_ms": 7546.287417004351,
          "usage": {
            "input_tokens": 248,
            "output_tokens": 808
          },
          "finish_reason": "stop",
          "reasoning_tokens": 802,
          "provider_error": null
        },
        {
          "sample_index": 1,
          "raw_response": "BAD",
          "parsed_verdict": "bad",
          "parse_status": "ok",
          "request_id": "retest-auto-d6da4c5b-1:row-1:sample-1",
          "wall_time_ms": 16929.69016698771,
          "usage": {
            "input_tokens": 248,
            "output_tokens": 1917
          },
          "finish_reason": "stop",
          "reasoning_tokens": 1911,
          "provider_error": null
        },
        {
          "sample_index": 2,
          "raw_response": "BAD",
          "parsed_verdict": "bad",
          "parse_status": "ok",
          "request_id": "retest-auto-d6da4c5b-1:row-1:sample-2",
          "wall_time_ms": 10593.59683401999,
          "usage": {
            "input_tokens": 248,
            "output_tokens": 1090
          },
          "finish_reason": "stop",
          "reasoning_tokens": 1084,
          "provider_error": null
        }
      ],
      "majority_vote": {
        "good": 0,
        "bad": 3,
        "abstain": 0,
        "verdict": "bad",
        "tie_broken": false
      },
      "tags": [
        "irrelevant-addition",
        "nighttime"
      ],
      "references": []
    },
    {
      "id": "row-2",
      "premises": [
        "n",
        "nr",
        "sa"
      ],
      "conclusions": [
        "ra"
      ],
      "analyst_verdicts": [
        "good"
      ],
      "analyst_rationales": null,
      "model_verdict": "bad",
      "samples": [
        {
          "sample_index": 0,
          "raw_response": "BAD",
          "parsed_verdict": "bad",
          "parse_status": "ok",
          "request_id": "retest-auto-d6da4c5b-1:row-2:sample-0",
          "wall_time_ms": 8672.630334011046,
          "usage": {
            "input_tokens": 256,
            "output_tokens": 1020
          },
          "finish_reason": "stop",
          "reasoning_tokens": 1014,
          "provider_error": null
        },
        {
          "sample_index": 1,
          "raw_response": "BAD",
          "parsed_verdict": "bad",
          "parse_status": "ok",
          "request_id": "retest-auto-d6da4c5b-1:row-2:sample-1",
          "wall_time_ms": 7355.273292021593,
          "usage": {
            "input_tokens": 256,
            "output_tokens": 904
          },
          "finish_reason": "stop",
          "reasoning_tokens": 898,
          "provider_error": null
        },
        {
          "sample_index": 2,
          "raw_response": "BAD",
          "parsed_verdict": "bad",
          "parse_status": "ok",
          "request_id": "retest-auto-d6da4c5b-1:row-2:sample-2",
          "wall_time_ms": 9344.049500010442,
          "usage": {
            "input_tokens": 256,
            "output_tokens": 994
          },
          "finish_reason": "stop",
          "reasoning_tokens": 988,
          "provider_error": null
        }
      ],
      "majority_vote": {
        "good": 0,
        "bad": 3,
        "abstain": 0,
        "verdict": "bad",
        "tie_broken": false
      },
      "tags": [
        "irrelevant-addition",
        "nonreflective"
      ],
      "references": []
    },
    {
      "id": "row-3",
      "premises": [
        "ba",
        "sa"
      ],
      "conclusions": [
        "ra"
      ],
      "analyst_verdicts": [
        "bad"
      ],
      "analyst_rationales": null,
      "model_verdict": "bad",
      "samples": [
        {
          "sample_index": 0,
          "raw_response": "BAD",
          "parsed_verdict": "bad",
          "parse_status": "ok",
          "request_id": "retest-auto-d6da4c5b-1:row-3:sample-0",
          "wall_time_ms": 5028.976958012208,
          "usage": {
            "input_tokens": 250,
            "output_tokens": 627
          },
          "finish_reason": "stop",
          "reasoning_tokens": 621,
          "provider_error": null
        },
        {
          "sample_index": 1,
          "raw_response": "BAD",
          "parsed_verdict": "bad",
          "parse_status": "ok",
          "request_id": "retest-auto-d6da4c5b-1:row-3:sample-1",
          "wall_time_ms": 4901.8835829920135,
          "usage": {
            "input_tokens": 250,
            "output_tokens": 546
          },
          "finish_reason": "stop",
          "reasoning_tokens": 541,
          "provider_error": null
        },
        {
          "sample_index": 2,
          "raw_response": "BAD",
          "parsed_verdict": "bad",
          "parse_status": "ok",
          "request_id": "retest-auto-d6da4c5b-1:row-3:sample-2",
          "wall_time_ms": 3332.9812080191914,
          "usage": {
            "input_tokens": 250,
            "output_tokens": 324
          },
          "finish_reason": "stop",
          "reasoning_tokens": 319,
          "provider_error": null
        }
      ],
      "majority_vote": {
        "good": 0,
        "bad": 3,
        "abstain": 0,
        "verdict": "bad",
        "tie_broken": false
      },
      "tags": [
        "defeater",
        "painted-blue"
      ],
      "references": []
    }
  ],
  "references": [],
  "paraphrase_variant": 0
}