{
  "schema_version": "1.0",
  "id": "retest-auto-126cd219-1",
  "benchmark_id": "stop-sign-intrinsic",
  "benchmark_hash": "sha256:e33415c3433ef36b9be304d0c7ed4d6f97e58cac02168e173fcef80da7023d08",
  "model": {
    "provider": "openai",
    "model_id": "gpt-5.4-mini",
    "params": {
      "temperature": 0.0,
      "max_tokens": 2048,
      "stop": []
    }
  },
  "endorsement_config": {
    "n_samples": 3,
    "tie_break": "abstain",
    "verification_prompt_id": "defeasible-explicit-v1",
    "context_builder_premise_id": "conjunction-and-v1",
    "context_builder_conclusion_id": "disjunction-or-v1"
  },
  "framework_version": "0.15.2",
  "started_at": "2026-06-08T05:55:54.153472Z",
  "finished_at": "2026-06-08T05:56:00.955765Z",
  "items": [
    {
      "id": "row-0",
      "premises": [
        "sa"
      ],
      "conclusions": [
        "ra"
      ],
      "analyst_verdicts": [
        "good"
      ],
      "model_verdict": "good",
      "samples": [
        {
          "sample_index": 0,
          "raw_response": "GOOD",
          "parsed_verdict": "good",
          "parse_status": "ok",
          "request_id": "retest-auto-126cd219-1:row-0:sample-0",
          "wall_time_ms": 475.6207919854205,
          "usage": {
            "input_tokens": 232,
            "output_tokens": 4
          },
          "finish_reason": "stop",
          "reasoning_tokens": 0
        },
        {
          "sample_index": 1,
          "raw_response": "GOOD",
          "parsed_verdict": "good",
          "parse_status": "ok",
          "request_id": "retest-auto-126cd219-1:row-0:sample-1",
          "wall_time_ms": 529.3932910135482,
          "usage": {
            "input_tokens": 232,
            "output_tokens": 4
          },
          "finish_reason": "stop",
          "reasoning_tokens": 0
        },
        {
          "sample_index": 2,
          "raw_response": "GOOD",
          "parsed_verdict": "good",
          "parse_status": "ok",
          "request_id": "retest-auto-126cd219-1:row-0:sample-2",
          "wall_time_ms": 467.99508298863657,
          "usage": {
            "input_tokens": 232,
            "output_tokens": 4
          },
          "finish_reason": "stop",
          "reasoning_tokens": 0
        }
      ],
      "majority_vote": {
        "good": 3,
        "bad": 0,
        "abstain": 0,
        "verdict": "good",
        "tie_broken": false
      },
      "tags": [
        "base-inference"
      ],
      "references": []
    },
    {
      "id": "row-1",
      "premises": [
        "n",
        "sa"
      ],
      "conclusions": [
        "ra"
      ],
      "analyst_verdicts": [
        "good"
      ],
      "model_verdict": "good",
      "samples": [
        {
          "sample_index": 0,
          "raw_response": "GOOD",
          "parsed_verdict": "good",
          "parse_status": "ok",
          "request_id": "retest-auto-126cd219-1:row-1:sample-0",
          "wall_time_ms": 624.0178750013001,
          "usage": {
            "input_tokens": 236,
            "output_tokens": 4
          },
          "finish_reason": "stop",
          "reasoning_tokens": 0
        },
        {
          "sample_index": 1,
          "raw_response": "GOOD",
          "parsed_verdict": "good",
          "parse_status": "ok",
          "request_id": "retest-auto-126cd219-1:row-1:sample-1",
          "wall_time_ms": 1031.1739590251818,
          "usage": {
            "input_tokens": 236,
            "output_tokens": 4
          },
          "finish_reason": "stop",
          "reasoning_tokens": 0
        },
        {
          "sample_index": 2,
          "raw_response": "GOOD",
          "parsed_verdict": "good",
          "parse_status": "ok",
          "request_id": "retest-auto-126cd219-1:row-1:sample-2",
          "wall_time_ms": 587.2327079996467,
          "usage": {
            "input_tokens": 236,
            "output_tokens": 4
          },
          "finish_reason": "stop",
          "reasoning_tokens": 0
        }
      ],
      "majority_vote": {
        "good": 3,
        "bad": 0,
        "abstain": 0,
        "verdict": "good",
        "tie_broken": false
      },
      "tags": [
        "irrelevant-addition",
        "nighttime"
      ],
      "references": []
    },
    {
      "id": "row-2",
      "premises": [
        "n",
        "nr",
        "sa"
      ],
      "conclusions": [
        "ra"
      ],
      "analyst_verdicts": [
        "good"
      ],
      "model_verdict": "good",
      "samples": [
        {
          "sample_index": 0,
          "raw_response": "BAD",
          "parsed_verdict": "bad",
          "parse_status": "ok",
          "request_id": "retest-auto-126cd219-1:row-2:sample-0",
          "wall_time_ms": 468.9213329984341,
          "usage": {
            "input_tokens": 244,
            "output_tokens": 10
          },
          "finish_reason": "stop",
          "reasoning_tokens": 0
        },
        {
          "sample_index": 1,
          "raw_response": "GOOD",
          "parsed_verdict": "good",
          "parse_status": "ok",
          "request_id": "retest-auto-126cd219-1:row-2:sample-1",
          "wall_time_ms": 546.2677920004353,
          "usage": {
            "input_tokens": 244,
            "output_tokens": 10
          },
          "finish_reason": "stop",
          "reasoning_tokens": 0
        },
        {
          "sample_index": 2,
          "raw_response": "GOOD",
          "parsed_verdict": "good",
          "parse_status": "ok",
          "request_id": "retest-auto-126cd219-1:row-2:sample-2",
          "wall_time_ms": 490.81404201569967,
          "usage": {
            "input_tokens": 244,
            "output_tokens": 4
          },
          "finish_reason": "stop",
          "reasoning_tokens": 0
        }
      ],
      "majority_vote": {
        "good": 2,
        "bad": 1,
        "abstain": 0,
        "verdict": "good",
        "tie_broken": false
      },
      "tags": [
        "irrelevant-addition",
        "nonreflective"
      ],
      "references": []
    },
    {
      "id": "row-3",
      "premises": [
        "ba",
        "sa"
      ],
      "conclusions": [
        "ra"
      ],
      "analyst_verdicts": [
        "bad"
      ],
      "model_verdict": "good",
      "samples": [
        {
          "sample_index": 0,
          "raw_response": "GOOD",
          "parsed_verdict": "good",
          "parse_status": "ok",
          "request_id": "retest-auto-126cd219-1:row-3:sample-0",
          "wall_time_ms": 534.9199580086861,
          "usage": {
            "input_tokens": 238,
            "output_tokens": 4
          },
          "finish_reason": "stop",
          "reasoning_tokens": 0
        },
        {
          "sample_index": 1,
          "raw_response": "GOOD",
          "parsed_verdict": "good",
          "parse_status": "ok",
          "request_id": "retest-auto-126cd219-1:row-3:sample-1",
          "wall_time_ms": 504.5365830010269,
          "usage": {
            "input_tokens": 238,
            "output_tokens": 4
          },
          "finish_reason": "stop",
          "reasoning_tokens": 0
        },
        {
          "sample_index": 2,
          "raw_response": "GOOD",
          "parsed_verdict": "good",
          "parse_status": "ok",
          "request_id": "retest-auto-126cd219-1:row-3:sample-2",
          "wall_time_ms": 531.9254169880878,
          "usage": {
            "input_tokens": 238,
            "output_tokens": 4
          },
          "finish_reason": "stop",
          "reasoning_tokens": 0
        }
      ],
      "majority_vote": {
        "good": 3,
        "bad": 0,
        "abstain": 0,
        "verdict": "good",
        "tie_broken": false
      },
      "tags": [
        "defeater",
        "painted-blue"
      ],
      "references": []
    }
  ],
  "references": [],
  "paraphrase_variant": 0
}
